query,intent
my direct reports ?,people
who are my direct reports,people
who are the direct reports of Ankit Gupta?,people
who is under Raghuram Nimishakavi Venkata's supervision?,people
who works directly under Chris Leung?,people
can you tell me which team members report to Jason Masten?,people
do you know who reports to Brandon Ruf?,people
could you let me know who answers to Enumula Reddy?,people
could you provide a list of individuals who report to Ayush Sharma?,people
who falls under the reporting line of Aishma Gupta?,people
what is the reporting structure under Ruhi Mirza?,people
who does Abhi Verma manage directly?,people
who does Arun Cherian oversee in their department?,people
who are Matt Coffey's subordinates?,people
who are the direct reports of Ankit Prakash in Firozabad?,people
who reports to Jake Trabant in Ulhasnagar?,people
can you tell me which team members report to Tanvi Singh in Bhavnagar?,people
do you know who reports to Paul Traore in Uttar Pradesh?,people
could you let me know who answers to Sanjay Wadge in Ranchi?,people
could you provide a list of individuals who report to Linda Timmons in Rajasthan?,people
who falls under the reporting line of Somto Idigo in Kalyan-Dombivali?,people
what is the reporting structure under Nick Wort in Nellore?,people
who does Kashyap Thacker manage directly in Dhanbad?,people
who does Aashish Narang Cust oversee in their department in Aligarh?,people
who are Achintya Shankhdhar's subordinates in Jammu?,people
who reports to Varun Pant in Akola?,people
team members under Digital CS in Varanasi?,people
who in Kota reports to Amelia Rose Kaderabek?,people
list of people under Divyansh Kumar in Pimpri-Chinchwad?,people
direct reports for Suraj Sharma in Agra?,people
Priyanka Sarkar manages who in Maharashtra?,people
who works for Vibhu Mishra in Kota?,people
Deepak Rawat's team in Punjab?,people
subordinates of Chae Stewart in Rajkot?,people
reporting to Pragya Dadhich in Kalyan-Dombivali?,people
Brian Ball reports Ambattur?,people
who under Krishan Kant Soni in Andhra Pradesh?,people
Austin Lemler team Maharashtra?,people
Aman Rai people Siliguri?,people
reports Diksha Bahuguna Haryana?,people
managed by Himanshu Rana in Maharashtra?,people
Chris Campbell subordinates West Bengal?,people
Twinkle Tiwari workers Kochi?,people
under Nikunj Aggarwal Ghaziabad?,people
team Shubham Taneja Karnataka?,people
Deepak Soni reports Tiruchirappalli?,people
who under Somna Bhardwaj in Jharkhand?,people
reports Bettelee Lambeth Uttar Pradesh?,people
who under John Tauzin?,people
Raman Kumar team?,people
Vidya Pichu people?,people
reports Sahil Kaushik?,people
managed by Amiya Lenka?,people
Mark Rabey subordinates?,people
Kay Lim workers?,people
under Aishma Gupta?,people
team Rishiraj Biswas?,people
who reports to Peeyush Verma?,people
team of Amelia Rose Kaderabek?,people
reports of Anjali Chauhan?,people
who does Allen Liang manage?,people
who works under Jamie Thompson?,people
subordinates of Divya Agrawal?,people
team under Dwight Thompson?,people
direct reports of Melissa Hewitt?,people
who does Lakshmi Joshi lead?,people
who does Brandon Chong oversee?,people
staff of Matt Shea?,people
who is in team of Samiksha Rana?,people
reports for Deepanshu Singhal?,people
reporting line of Don Wight?,people
org below Aimee Abel?,people
who is below Suraj Sharma?,people
juniors of Jordan Katz?,people
direct reports for Santosh Kumar?,people
who answers to Asmita Patidar?,people
hierarchy of Ayushi Singh?,people
who works for Brendan Ballintine?,people
department staff of Aman Rai?,people
reportees of Priyamvada Bhardwaj?,people
org chart of Darien Ngo?,people
who is managed by Manu Bhardwaj?,people
crew of Matt Shea?,people
associates of Tirumala Vasamsetty?,people
staff under Raghuram Nimishakavi Venkata?,people
assistants of Mike Boring?,people
who does Gil Blustein direct?,people
people under Krystal McCann?,people
people of Anirudh R?,people
junior staff of Josh Witty?,people
who belongs to team of Priyanshi Thakur?,people
who works with Ruhi Mirza as report?,people
office team of Vishvajeet Singh?,people
who are team members of Patrick Kilcommons?,people
who falls under Candace Hartman?,people
chain of command for Aayushi Singh?,people
org tree of Jane Manager?,people
who comes under Yash Aggarwal?,people
line reports of Sahil Tyagi?,people
downstream of Udayraj Sathe?,people
who does Phil Lacorte supervise?,people
branch staff of Jane Manager?,people
who works directly under Ankit Gupta?,people
working team of Keara Brosnan?,people
who is guided by Amal Kumar Bharali?,people
support staff of Nirmal Kumat?,people
operating team of Sync Marketo?,people
who does Mukund Ramachandran oversee?,people
lower level of Kristen Best?,people
inner team of Gary Sevounts?,people
who is managed by Kaweesak Boonyapornnad?,people
who does Mike McDermott handle?,people
immediate team of Helen Oleksiv?,people
who does Santosh Kumar lead?,people
who is part of unit of Bala Arun Reddy Vatti?,people
team members list of Jack Berry?,people
who reports upward to Ian Martin?,people
who reports to Reshab Vaigankar in Visakhapatnam?,people
team of Shalvi Johari in Rajasthan?,people
reports of SK Manoharan in Hyderabad?,people
who does Arihant Jain manage in Uttar Pradesh?,people
who works under Daniel Kim in Gwalior?,people
subordinates of Justin Pena in Punjab?,people
team under Jeanne Mickey in Gwalior?,people
direct reports of Keara Brosnan in Firozabad?,people
who does Faiz Kamran lead in Bikaner?,people
who does Harsh Dubey oversee in Karnataka?,people
staff of Somna Bhardwaj in Rajasthan?,people
who is in team of Nick Rose in Chhattisgarh?,people
reports for Ankur Arora in Rajasthan?,people
reporting line of Celia Madden in Firozabad?,people
org below Rajan Talwar in Kalyan-Dombivali?,people
who is below Pinku Kumar in Vijayawada?,people
juniors of Jeri Feng in Kozhikode?,people
direct reports for Robert Pearson in Uttarakhand?,people
who answers to Chirag Arora in Patiala?,people
hierarchy of Nitin Jain in Karnataka?,people
who works for Bala Kasiviswanathan in Tamil Nadu?,people
department staff of Mike Villett in Mysore?,people
reportees of Sai Varma in Sangli-Miraj and Kupwad?,people
org chart of Sanjay Wadge in Madurai?,people
who is managed by Sahil Tyagi in Maheshtala?,people
crew of Vijai Shankar in Gulbarga?,people
associates of Ankit Prakash in Rajpur Sonarpur?,people
staff under Candace Hartman in Kanpur?,people
assistants of Jason Morris in Bihar?,people
who does Mohammad Zaid direct in Jammu?,people
people under Sahil Tyagi in Madhya Pradesh?,people
people of Fay Karchagani in Haryana?,people
junior staff of Udayraj Sathe in Karnataka?,people
who belongs to team of Alok Kumar in Chhattisgarh?,people
office team of Christina Monson in Maharashtra?,people
who are team members of Carolyn Clark in Ajmer?,people
who falls under Tanya Chawla in Tirupur?,people
chain of command for Rahul Verma in Uttar Pradesh?,people
org tree of Austin Lemler in Ambattur?,people
who comes under Krati Singhal in Karnataka?,people
line reports of Harsh Dubey in Pune?,people
downstream of Andre Gerard in Moradabad?,people
who does John Ennis supervise in Uttar Pradesh?,people
branch staff of Harsh Verma in Gujarat?,people
who works directly under Sanjay Wadge in Maharashtra?,people
working team of Sean Coleman in Maharashtra?,people
who is guided by Rahul Verma in Kerala?,people
support staff of Aashish Narang Cust in Jammu?,people
operating team of Tarun Singh in Kolkata?,people
who does Parinay Prateek oversee in Firozabad?,people
lower level of Ankur Gupta in Thiruvananthapuram?,people
inner team of Shivani Chauhan in Chandigarh?,people
who is managed by Priyanka Sarkar in Aligarh?,people
who does Ben Elder handle in Lucknow?,people
immediate team of Rishiraj Biswas in Vijayawada?,people
who does Keara Brosnan lead in Chhattisgarh?,people
who is part of unit of Andrei Zhukov in Maharashtra?,people
team members list of Kleavin Howatt in Raipur?,people
who reports upward to Mahima Varshney in Maharashtra?,people
team under Kay Dugger in Tripura?,people
my manager?,people
who is my manager ?,people
who is Abhishek Saini manager?,people
who is Vishal Sharma's supervisor?,people
can you tell me who manages Deepak Soni?,people
who is in charge of Randy Womack?,people
who does Siddharth Sharma report to?,people
i'd like to know Aaron Levermann's team leader; who is it?,people
who oversees Anjana Menon?,people
who is Makenzie Shaw's boss?,people
who is ritankar Paul's department head?,people
can you provide the name of Bharat Madaan's manager?,people
who is responsible for Harleen Mehta?,people
who's Srinija Jilla's boss?,people
Brendan Patterson's manager?,people
who handles Nick Perdomo?,people
Melanie Okada's supervisor?,people
who's in charge of Prince Gola?,people
who's Rohit Kumar answer to?,people
Robert Strohmeyer's head?,people
who's above Brad Jager?,people
Adam Laker's boss name?,people
who's Niyati Jain report to?,people
who's Kay Dugger under?,people
Monica Zhang's lead?,people
in charge of Prasanna Mishra?,people
who manages Andre Gerard?,people
Sourya Kaushik's go-to?,people
point person for Akanksha Kumari?,people
Diksha Bahuguna's overseer?,people
who's Andrew Williamson's higher-up?,people
Anuj Gupta's superior?,people
head honcho for Parinay Prateek?,people
"Adil Shamim's boss, who?",people
manager of Shubham Jain?,people
Asmita Patidar reports to who?,people
supervisor for Noah Smithson?,people
Anjana Menon's chief?,people
overseer of Charan B?,people
who heads Douglas Fehrmann II?,people
Abhi Verma's managing person?,people
John Ennis works for who?,people
who manages Ana Ajzele?,people
who is the boss of Brendan Ballintine?,people
who does Rana Singh report to?,people
direct manager of Dawn Farhi?,people
line manager for Ankit Prakash?,people
who is Don Wight's overseer?,people
leadership above Sohan Swain?,people
who is over Kunal Shukla?,people
authority above Kleavin Howatt?,people
manager above Himanshu Rana?,people
who is head of Yashi Gupta?,people
leader of Christine Davis?,people
superior officer of Poorvi Shukla?,people
whose command is Nilesh Thakur under?,people
who supervises Nick Wort?,people
who directs MacKenzie Crow?,people
head of Mike McDermott?,people
immediate manager of Matt Coffey?,people
higher authority for Matt Shea?,people
who controls Nivika Malhotra?,people
executive above Shubham Garg?,people
admin over Monica Zhang?,people
who oversees Shubham Bhardwaj?,people
who leads Dhruv Vashist?,people
top boss of Adam Laker?,people
who is senior to Sahil Garg?,people
managing authority of Christy Schoon?,people
guidance for Brianna Dougherty comes from who?,people
who commands Rhonda Orman?,people
manager in charge of Jake German?,people
management over Dan Gallo?,people
who has charge of Harsh Dubey?,people
accountable manager for Lokesh Kumar?,people
to whom does Tanya Chawla report?,people
who is in charge of Brendan Ballintine?,people
which manager has Nazim Akhtar?,people
whose team includes Kevin Cox?,people
head responsible for Anna Korniienko?,people
reporting manager of Sadi Hussain?,people
who directs work of Daniel Batista?,people
who handles Amange Al-Jaf?,people
supervisor assigned to Sahil Tyagi?,people
senior officer of Raghav Tyagi?,people
top manager of Vikrant Naik Gaonkar?,people
leader responsible for Mohammad Zaid?,people
to which manager is Samiksha Rana assigned?,people
who is responsible for Shubham Jain?,people
who leads over Anna McDonald?,people
chain of command above Renisha Dias?,people
senior in charge of Vedran Rutnik?,people
who controls work of Rajesh Saini?,people
who gives orders to Vikram Singh?,people
whose supervision is Mahir Kukreja under?,people
who directs tasks of Shashank Verma?,people
who has authority over Austin Lemler?,people
who manages the work of Biswajit Das?,people
whose leadership is Madhavi Polepeddi under?,people
head responsible above Himanshu Shekher?,people
who is higher authority for Sachin Verulkar?,people
who governs Jason Li?,people
boss responsible for Aaron Levermann?,people
who is at the top of Yulling Tsai?,people
management head of Raj Kishan Rawat?,people
supervisor responsible for Tarun Singh?,people
who is commander of Chris Campbell?,people
who directs and manages Bharat Madaan?,people
who is over and above Yatin Manchanda?,people
to whom is Sudarshan Shenoy answerable?,people
manager who oversees Arbind Kumar?,people
whose authority is Daniel Kim under?,people
executive responsible for Laxman Kaande?,people
who guides Mike McDermott?,people
whose management is Mayank Sethi under?,people
who has power over Jason Li?,people
who is main manager of Pranshu Gupta?,people
whose supervision guides Anisha Agarwal?,people
who is superior to Rafael Lupian?,people
under whose charge is Rohit Kumar?,people
who heads work of PiyushCust RajputMer?,people
who is administrative head for Shubham Jain?,people
higher manager of Neha Sharma?,people
lead for Rishiraj Biswas?,people
who monitors Dawn Devine?,people
whose direction does Parul Sharma follow?,people
responsible manager for Adarsha P?,people
who has leadership over Brandon Ruf?,people
manager handling Dominic Giuliani?,people
supervisor managing Vineet Kane?,people
boss in charge of Evan Kibert?,people
leader accountable for Raghav Sharma?,people
who runs Ansh Dhingra?,people
head assigned to Claire Sharif?,people
immediate superior of Trinh Dao?,people
who commands over Shaun Spinelli?,people
who controls activities of Ankur Khandelwal?,people
who heads the team of Pranshu Gupta?,people
to whom is Rishabh Ahuja responsible?,people
senior head of Jaime Rodriguez?,people
authority guiding Rajesh Saini?,people
overhead manager of Soham Ratilal Munot?,people
head leader for Palak Rathor?,people
who acts as boss for Adarsha P?,people
top authority over Samiksha Rana?,people
senior guide of Rachana Pandey?,people
chief manager for Raghav Takkar?,people
overall manager for Vikrant Naik Gaonkar?,people
who has seniority over Kleavin Howatt?,people
leadership assigned to Dawn Farhi?,people
who has responsibility over Sopan Mittal?,people
reporting authority for Ashish Narang?,people
managing lead for Rahul Verma?,people
who is directing Sandeep Kasar?,people
under whose leadership is Keerthana Ks?,people
who is accountable for Neha Manhas?,people
commanding officer for Sarah Swanberg?,people
main boss of Mike McDermott?,people
manager who guides Abhishek Saini?,people
head managing Rajesh Saini?,people
who does Mike McDermott answer to?,people
whose control is Shashank Verma under?,people
responsible head for Siddharth Sharma?,people
leader in charge of Priti Sharma?,people
who controls and guides Julian Dye?,people
which head manages Reshab Vaigankar?,people
senior authority over Koji Moy?,people
direct boss of Service Account?,people
who is Darien Ngo's reporting authority?,people
who is above Kaweesak Boonyapornnad in hierarchy?,people
manager allocated to Manju Bhardwaj?,people
head overseeing Kumar Shubham?,people
authority responsible for John Tauzin?,people
who all are my peers?,people
my peers ?,people
who are peers of Divyansh Arya ?,people
who are Tarun Singh's peers?,people
who are Joe Matten's compeers?,people
who are Hilary Somers's coevals?,people
who are Krishan Kant Soni's coequals?,people
who are the peers of Maggie Moran?,people
who are the compeers of Kevin Clifford?,people
who are the coevals of Saurav Rawat?,people
who are the coequals of Akash Chauhan?,people
who are the colleagues or peers of Santosh Kumar?,people
who are the other coevals working alongside Rhonda Orman?,people
"within this organization, who are considered Rakshita Jain's peers?",people
who are the contemporaries of Shahir Ali T Azeez?,people
who are the colleagues of Anmol Srivastava?,people
who are the others at the same level as Prathyusha Aparacheruvu?,people
who are the counterparts of Ankur Arora?,people
who are Shubham Jain's professional equals?,people
who are Marija Sakic Alic's fellow professionals?,people
Chandra Mohan Yadav's peers ?,people
Kim Luu compeers ?,people
who are peers of Nick Rose from Nanded Waghala?,people
who are the colleagues at the same level as Anshuman Borkakoti in West Bengal?,people
who in Maheshtala constitutes Vishal Sharma's network of peers?,people
who are Pushker Yadav's professional equals from Hubli and Dharwad?,people
can you identify other coequals working alongside Andre Gerard in Karnataka?,people
"who, from Tirunelveli, are considered Aayushi Singh's professional compeers or coequals?",people
Freny Fernandes's coequals in Vijayawada?,people
Aashish Narang Cust's compeers in Ujjain?,people
Rhonda Orman's peers in Saharanpur?,people
who are Siddharth Sharma's work peers in Jalandhar?,people
who's Adarsha P's colleagues or peers in Odisha?,people
name some peers of PiyushCust RajputMer in Agartala.,people
who's at the same rank as Mayur Gaikwad in Nellore?,people
who are peers of Austin Lemler who joined on 03-07-2024?,people
peers of Shashank Tripathi joined on 01/01/2013?,people
compeers of Insights Integration joined on 01 January 2018?,people
coequals of Christine Robertson joined on 2016-01-01?,people
colleagues at same level as Rajat Gupta joined on 07/03/2024?,people
who's Sonali Gupta's colleagues or peers who joined on 01/01/2024?,people
who's at the same rank as Sync Marketo who joined on  01/01/2019?,people
name some peers of Shashank Tripathi who joined on 01/01/2023.,people
can you identify other coequals working alongside Sahil Tyagi who joined on 01/01/2013?,people
who are Chris Leung's professional equals who joined on 01/01/2020?,people
who all who joined on 2022-01-01 network of peers of Kay Dugger ?,people
who are peers of Arun Cherian from Bihar who joined on 2018-01-01?,people
who are the colleagues at the same level as Parag Kulkarni in Punjab who joined on 01/01/2021?,people
who in Kalyan-Dombivali who joined on 01/01/2024 constitutes Amit Gupta's network of peers?,people
who are Gargi Pawar's professional equals from Odisha who joined on 15/10/2015?,people
can you identify other coequals working alongside G N Vishaar in Cuttack who joined on 01 January 2021?,people
"who, from Guwahati, joined on 01/01/2020 are considered Rachel Smith's professional compeers or coequals?",people
Navdeep Yadav's coequals in West Bengal joined on 01/01/2016?,people
Surendra Padala's compeers in Maharashtra joined on 01/01/2018?,people
Bettelee Lambeth's peers in Kerala joined on 01/01/2022?,people
who are Sandeep Singh's work peers joined on 01 January 2013 in Punjab?,people
who's Cate Beggins's colleagues or peers joined on 01/01/2024 in Rajasthan?,people
name some peers of Enumula Reddy in Uttar Pradesh who joined on 2016-01-01?.,people
who's at the same rank as Abhishek Kumar in Jodhpur who joined on 01/01/2021?,people
who are peers of Huy Nguyen working as TA Ops Specialist ?,people
peers of Tony Tarantino working as Senior Technical Support Engineer ?,people
compeers of Vladyslav Komarov working as Associate Test Engineer ?,people
"coequals of Justin Pena working as VP, Sales Enablement ?",people
Senior IT Engineer who are Palak Rathor peers?,people
Support Operations Manager who are Randy Womack compeers?,people
"Sr. Manager, SaaS Applications who are Andrea Rowland coequals?",people
who are the colleagues at the same level as Douglas Fehrmann II working as Sr. Project Manager?,people
"Director, Implementation Consulting constitutes Reema Sarah Thomas's network of peers?",people
"who are Shivangi Srivastava's professional equals who are Director, Dev Ops?",people
"can you identify other coequals working alongside Jamie Yan who are SVP, Sales?",people
who are all Sr. Marketing Coordinator considered Jamie Yan's professional compeers or coequals?,people
who are John Tauzin's work peers working as Technical Program Manager?,people
who's Michael Berger's colleagues or peers working as Sr. Solutions Consultant?,people
name some peers of Randy Womack working as Sr. Accounting Manager.,people
who's at the same rank as Chae Stewart who work as Support Operations Manager?,people
"who are peers of Akanksha Kumari working as Principal Product Manager, Employee Virtual Assistant from Gulbarga?",people
who are the compeers of Bettelee Lambeth working as Chief Executive Officer from Maharashtra?,people
compeers of Makenzie Shaw working as Strategy & Operations Manager from Kerala?,people
coequals of Sandeep Kasar working as SMB Account Executive from Aligarh?,people
peers of Ashish Narang working as Revenue Operations Specialist from Uttar Pradesh?,people
who are the coequals of Monica Zhang working as Senior IT Engineer from Kolhapur?,people
who are the peers of Harish Rathor working as RFP Manager from Jalandhar?,people
"who, in Kozhikode, are Gargi Pawar's compeers working as Revenue Ops Analyst?",people
"who, in Hubli and Dharwad, are Mary Cate Thalgott's peers who work as Architect Testing?",people
"who, in Agartala, are Rishab Surana's coequals work as Principal Design Architect?",people
who are Anmol Varshney's professional compeers working as Lead Test Engineer in Ujjain?,people
professional compeers of Nick Stipinovich working as RFP Manager in Aligarh?,people
"who are Fay Karchagani's professional peers working as VP, User Experience in Guntur?",people
professional peers of Aman Mehrat working as Architect Testing in Gujarat?,people
who are Ravina Habbu's professional coequals working as Principal Product Manager in Jaipur?,people
professional coequals of Allison Schuchart working as Marketing Copywriter in Tamil Nadu?,people
who are Jeff Schiller's professional coequals working as Lead Graphic Designer in Gaya?,people
identify Patrick Kilcommons's peers working as ABM Sr. Marketing Manager from Pimpri-Chinchwad.,people
" Diksha Bahuguna's compeers or coequals working as Product Management Director, Enterprise Search from Bihar.",people
who are peers of Evan Warner working as Information Security Engineer who joined on 01/01/2024?,people
who are the compeers of Marko Kostervajn working as Business Development Rep who joined on 01/01/2014?,people
"who are the coequals of Rajat Verma working as Senior Director, Professional Services who joined on 01/01/2018?",people
identify Sourya Kaushik's compeers working as Chief Info Security Officer who joined on 01/01/2014.,people
identify Mayank Sethi's coequals working as Credit & Collections Analyst who joined on 01/01/2016.,people
Madhavi Polepeddi's peers working as Sales Development Manager who joined on 01/01/2022.,people
Priyanshi Thakur's compeers as Credit & Collections Analyst from 01/01/2016?,people
Aayushi Singh's coequals as Principal Design Architect from 01/01/2022?,people
"John Tauzin's peers as Senior Executive, People Ops from 01/01/2015?",people
Christine Davis's professional compeers as Chief Insights Officer joining on 01 January 2014?,people
who are Tatyana Grinenko's professional coequals as Lead Graphic Designer joining on 01/01/2020?,people
who are Kevin Cox's professional peers as Technical Support Lead joining on 10/15/2015?,people
who in the same role as Justin Ryckebusch joined on 2021-01-01?,people
"from 01/01/2024, who are the compeers of Kanika Arora working as Digital Customer Success Program Manager?",people
who are peers of Ivan Kos from Lucknow working as Sr. Marketing Programs Manager who joined on 01/01/2022?,people
who are the compeers of Tarunesh Kumar Gautam from Karnataka working as Sr. Compensation Analyst who joined on 01/01/2017?,people
who are the coequals of William Cope from Uttar Pradesh working as Sr. Implementation Consultant who joined on 01/01/2020?,people
who are the peers of Ajay Singh from Gaya working as Support Operations Manager who joined on 01 January 2015?,people
identify Linnea Yeazel's compeers from Mira and Bhayander working as Architect who joined on 2020-01-01.,people
identify Neha Singla's coequals from Ranchi working as Team Lead who joined on 2024-01-01.,people
"identify Christine Davis's peers from Allahabad working as VP, Total Rewards, HRIS & Operations who joined on 01/01/2014.",people
Danyelle Kent's compeers from Tamil Nadu working as Business Development Rep who joined on 01 January 2024?,people
Rafael Lupian's coequals from Maharashtra working as Value Consulting Director who joined on 03/07/2024?,people
Digital CS's peers from Bellary working as Lead Graphic Designer who joined on 01/01/2022?,people
who else from Kanpur joined as Billing and Revenue Specialist on 01/01/2022 who are peers of Andrea Rowland ?,people
who are Ana Ajzele's professional compeers from Salem as Mid Market Account Executive joining on 15 October 2015?,people
"who are Rishiraj Biswas's professional coequals from Uttar Pradesh as Software Engineer, Front End joining on 01/01/2013?",people
"who are Pranshu Gupta's professional peers from Uttar Pradesh as Director, Dev Ops joining on 01/01/2016?",people
"compeers from Kolhapur working as Director, Customer Success who joined with Jennell Dill on 2018-01-01?",people
peers from Moradabad working as Project Manager who joined with Prathyusha Aparacheruvu on 01/01/2023?,people
who else from Uttar Pradesh joined as Creative Director on 01/01/2017 who are compeers of Shubhada Gayakwad ?,people
who else from Meerut joined as Senior Web Developer on 01/01/2015 who are coequals of Pratik Yagnik ?,people
coequals from Warangal working as Team Lead who joined with Rishiraj Biswas on 01/01/2018?,people
who works at the same level as Brianna Dougherty?,people
who shares Viviana Serrato Sotelo position?,people
who are Luciano Ferrari equals?,people
who holds the same role as Deepak Rawat?,people
who matches Tanmay Lanjewar in hierarchy?,people
same level colleagues for Sahil Kaushik?,people
who is alongside Pranshu Gupta?,people
who is parallel to Mary Cate Thalgott?,people
who stands equal to Reema Sarah Thomas?,people
who ranks equal to Calvin Lee?,people
