query,intent
who is on par with Mike McDermott?,people
peers list for Elliot Egharevba?,people
show me Krystal McCann peers?,people
give Pragya Dadhich equals?,people
identify peers of Manju Bhardwaj?,people
which people are same rank as Anmol Srivastava?,people
whose role matches Shambhavi Belligatti?,people
colleagues at Kaweesak Boonyapornnad level?,people
equal rank colleagues of PiyushCust RajputMer?,people
same designation as Tarun Singh?,people
who matches the title of Kamal Sharma?,people
who has peer role to Abhishek Singh?,people
whose grade equals Somna Bhardwaj?,people
who are coworkers equal to Elliot Egharevba?,people
equals of Bala Arun Reddy Vatti in company?,people
list Kashyap Thacker professional equals?,people
who is co-level with Digital CS?,people
same tier staff as Monica Zhang?,people
parallel role to Amanda Pham?,people
at Dawn Farhi level who else works?,people
who is on same ladder as Amit Kumar?,people
workplace peers of Pooja Pathak?,people
give coequals of Mike Villett?,people
give me colleagues of Krati Singhal?,people
anyone peer with Miriam Connaughton?,people
who are in same job band as Lindsey Egan?,people
colleague group with Shubham Bhardwaj?,people
who works parallel to John Kelly?,people
same level team for Mayur Gaikwad?,people
who is contemporary to Suraj Sharma?,people
peers standing with Darien Ngo?,people
other peers for Raghav Takkar?,people
show peers of Sanjla Sindhwani?,people
list out Miriam Connaughton peers?,people
colleagues beside Sanjay Wadge?,people
equals in role of Jamie Yan?,people
peer circle for Danyelle Kent?,people
who are fellow colleagues with Jane Manager?,people
identify equals of Dario Kaja?,people
list coequals for Ajay Singh?,people
same level workers with Mike Boring?,people
others working with Sevanthika S at peer level?,people
team peers with Jeri Feng?,people
who matches Michael Minner seniority?,people
show coworkers equal to Anthony Mazur?,people
colleagues at peer level to Jordan Katz?,people
who else holds peer position of Makenzie Shaw?,people
equals to Justin Pena in office?,people
company peers of Arun Cherian?,people
job peers of Arihant Jain?,people
who are parallel peers of Evan Warner?,people
same group as Akanksha Kumari?,people
who has peer relation with Krishna Varanasi?,people
same job tier as Don Wight?,people
professional peers of Adam Laker?,people
work equals of Rahul Panchal?,people
who works peer to Eric Tine?,people
any colleague peer to Monica Zhang?,people
same designation peers of Sandeep Kasar?,people
coworkers same level as John Kim?,people
office peers of App Integrations?,people
job equals of Darien Ngo?,people
professional equals with Priyanka Sarkar?,people
equal coworkers of Harshita Hajela?,people
same rung colleagues as Kaitlin Stouter?,people
rank equals of Kevin Plaza?,people
peers aligned with Harsh Dubey?,people
peers sitting with Neeral Singh?,people
other equals to Aaron Levermann?,people
fellow peers of Brandon Ruf?,people
colleagues sharing rank with Vikash Tiwari?,people
list peers under Vedant Mehrotra level?,people
equals at Melanie Okada designation?,people
equal grade staff with Som Agarwal?,people
identify coworkers same as Kanish Gandhi?,people
colleague equals Shubham Singh?,people
professional level equals of Allen Liang?,people
peers in company for Divya Agrawal?,people
equal status workers with Krishna Varanasi?,people
list same role colleagues of Deepak Rawat?,people
other equals who match Katie Fred?,people
name Abhishek Singh colleagues?,people
who are coworkers peer of Piyush Rajput?,people
peers standing in same band as Pankaj Sharma?,people
equal level staff alongside Josh Topel?,people
who shares equal grade with Steve Glass?,people
contemporary staff to Anna McDonald?,people
name equals of Sandeep Singh?,people
equal coworkers as Dario Kaja?,people
equals with Vinay Gautam role?,people
show same level employees with Ankur Khandelwal?,people
list coworkers with Nikhil Kumar role?,people
who works in peer line with Breana Raffel?,people
give list of equals for Raghav Takkar?,people
peers in Chhattisgarh with Sachin Verulkar?,people
who equals Joe Matten in Navi Mumbai?,people
colleagues at Sandeep Kasar level in Tamil Nadu?,people
which peers are with Kamal Sharma in Bihar?,people
peers for Ritika Trehan in Bikaner?,people
who is equal to Robert Pearson in Odisha?,people
professional peers of Bhavana Mahalwal in Uttar Pradesh?,people
contemporaries of Rohan Mondal in Punjab?,people
equal grade workers with Shubham Taneja in Bellary?,people
team peers with Ankur Gupta in Mumbai?,people
coworkers alongside Mark Terifaj in Nanded Waghala?,people
fellow equals of Lani Moreno in Mumbai?,people
same role as Tushar Gosalia in Tirunelveli?,people
other equals of Urushi Rajput in Karnataka?,people
who is at the same level as Akshaya Joshi?,people
who shares the position with Davin Wilfrid?,people
who are equals of Shubham Singh?,people
who holds the same role as Tirumala Vasamsetty?,people
who matches Aman Mehrat in hierarchy?,people
same level colleagues of Brandon Ruf?,people
who is alongside Talissa Davis?,people
who is parallel to Sean Coleman?,people
who stands equal to Chris Campbell?,people
who ranks equal to Abhishek Singh?,people
who is on par with Divya Agrawal?,people
peers list of Kaitlin Stouter?,people
show peers of Edward Estandarte?,people
give equals of Ankit Gupta?,people
identify peers of Lokesh Kumar?,people
which people are at the same rank as Linda Timmons?,people
whose role matches Sabika Nazim?,people
colleagues at the level of Ajay Singh?,people
equal rank colleagues of Pranshu Gupta?,people
same designation as Rajat Verma?,people
who matches the title of Sean Coleman?,people
who has a peer role to Sonu Kumar?,people
whose grade equals Justin Ryckebusch?,people
who are coworkers equal to Shashank Tripathi?,people
equals of Brandon Sides in the company?,people
list professional equals of Brandon Ruf?,people
who is co-level with Divya Jain?,people
same tier staff as Mary Cate Thalgott?,people
parallel role to Amit Kumar?,people
at Yawei Liang level who else works?,people
who is on the same ladder as Lakshay Gupta?,people
workplace peers of Pushpak Anand?,people
give coequals of Rachana Pandey?,people
give me colleagues of Chandra Mohan Yadav?,people
anyone peer with Sachin Verulkar?,people
who is in the same job band as Randall Kerr?,people
colleague group with Sabika Nazim?,people
who works parallel to Somto Idigo?,people
same level team as Rohit Kumar?,people
who is contemporary to Anna McDonald?,people
peers standing with Krishna Kant Kaira?,people
other peers of Arun Cherian?,people
show equal colleagues of Aman Kumar Mishra?,people
list out peers of Neeral Singh?,people
colleagues beside Shubham Garg?,people
equals in the role of Jake Patterson?,people
peer circle of Harsh Dubey?,people
who are fellow colleagues of Monica Zhang?,people
identify equals of Anagh Desai?,people
list coequals of Laxman Kaande?,people
same level workers as Ritvik Singh?,people
others working with Yulling Tsai at peer level?,people
team peers with Dhruv Vashist?,people
who matches Shoba Elaiyavalli in seniority?,people
show coworkers equal to Tony Tarantino?,people
colleagues at peer level to Cate Beggins?,people
who else holds peer position of Aykut Firat?,people
equals of Shambhavi Belligatti in office?,people
company peers of Clyde Noronha?,people
job peers of Laxman Kaande?,people
who are parallel peers of Sergey Desyatkov?,people
same group as Cindy Yee?,people
who has peer relation with Somna Bhardwaj?,people
same job tier as Deepak Rawat?,people
professional peers of Kashyap Thacker?,people
work equals of Julian Dye?,people
who works peer to Shubham Garg?,people
any colleague peer to Ravikanti Vamshi Krishna?,people
same designation peers of Anjana Menon?,people
coworkers at the same level as Mike Messinger?,people
office peers of Harjinder Singh?,people
job equals of Nick Stipinovich?,people
professional equals of Sarah Swanberg?,people
equal coworkers of SK Manoharan?,people
same rung colleagues as Varun Pant?,people
rank equals of Julian Dye?,people
peers aligned with Arbind Kumar?,people
peers working with Pushpak Anand?,people
other equals of Mukund Ramachandran?,people
fellow peers of Robert Strohmeyer?,people
colleagues sharing rank with Varun Pant?,people
list peers under Neeral Singh level?,people
equals at Josh Topel designation?,people
equal grade staff with Priyamvada Bhardwaj?,people
identify coworkers same as John Kelly?,people
colleague equals of Michelle Yek?,people
professional level equals of Elliot Egharevba?,people
peers in company for Kanika Arora?,people
equal status workers with Devraj Gurjar?,people
list same role colleagues of Eric Noe?,people
other equals who match Christian Martinez?,people
name colleagues of Eric Noe?,people
who are coworkers at peer level with CX Provisioning Team?,people
peers standing in the same band as Brooke Narin?,people
equal level staff alongside Parinay Prateek?,people
who shares equal grade with Kevin Wu?,people
contemporary staff to Ravi Kiran Kanneganti?,people
name equals of Yawei Liang?,people
equal coworkers as Tirumala Vasamsetty?,people
equals with the role of Nikhil Kumar?,people
show same level employees with Sync Marketo?,people
list coworkers with the role of Himanshu Shekher?,people
who works in the peer line with Nivika Malhotra?,people
give list of equals for Courtney Tavernit?,people
peers in the city with Senthil Kumar Arumugam?,people
who equals Shubham Jain in the city?,people
colleagues at Twinkle Tiwari level in the city?,people
which peers are with Raghuram Nimishakavi Venkata in the city?,people
peers for Matthew Rawls in the city?,people
who is equal to Jeff Ganthavorn in the city?,people
professional peers of Kulwinder Singh in the city?,people
contemporaries of Ansh Dhingra in the city?,people
equal grade workers with Aman Rai in the city?,people
team peers with Kevin Plaza in the city?,people
coworkers alongside Sachin Verulkar in the city?,people
fellow equals of Vaibhav Chauhan in the city?,people
same role as Jaimik Patel in the city?,people
other equals of Deepak Soni in the city?,people
equals of Alejandro Escudero in the department?,people
peers in the department with Nandini Seth?,people
colleagues at the same grade as Lucas Kehs?,people
list equals for Neha Manhas in the department?,people
Lucas Kehs?,people
RFP Manager?,people
who is Christina Monson?,people
who exactly is Senthil Kumar Arumugam?,people
can you tell me who Sumit Suman is?,people
i'd like to know more about Divyansh Kumar; who are they?,people
could you provide some details about Adam Laker?,people
who's Jason Morris?,people
what do you know about Mohd Hassaan?,people
"who is K Amrish, exactly?",people
could you enlighten me about Jaken Lindenmeyer?,people
who is People Ops Specialist?,people
who is the current Sr. HR Business Partner?,people
"can you tell me who holds the title of HR, Business Partner?",people
who is known as the Senior Data Scientist?,people
who is known as the Sr. Project Manager expert?,people
who presently serves as the Sr. Compensation Analyst?,people
i'd like to know who the Sr. Marketing Coordinator is.,people
who's recognized as the ABM Sr. Marketing Manager?,people
could you inform me about the current Value Consulting Director?,people
"who is acting as the VP, Revenue Operations right now?",people
who has the position of Senior Program Manager?,people
can you provide details on who the Associate Product Manager is?,people
who's Mid Market Account Executive?,people
who holds the Product Manager spot?,people
current Accountant?,people
who is Brent Soffey working in Recognition?,people
who is Nivika Malhotra in the Security?,people
can you tell me who Suzanne McReynolds is in the Internal Communications?,people
what's Ivan Kos's role in the Content Strategy?,people
can you explain who Yatin Manchanda is in the Content Strategy?,people
who's Tony Tarantino and what do they do in Internal Communications?,people
who's Adil Shamim in Internal Communications?,people
Arbind Kumar in Legal? who's that?,people
what's Shubham Garg do in Technical Support?,people
what does Lean Data do in Technical Support?,people
Vaibhav Chauhan working in Product Management ?,people
Andrea Macek Kessler working in Content Strategy who joined on 01/01/2019?,people
Ravikanti Vamshi Krishna in Platform Services since 2024-01-01?,people
Davin Wilfrid working in Finance from 2022-01-02?,people
who's Nirmal Kumat in Field Marketing joined on 01/01/2013?,people
Mayank Sethi from Operations Strategy joined 01/01/2016?,people
Vivianne Lauslahti in Customer Experience starting 01 January 2022?,people
Salil Bhatnagar working in Product since 2022-01-01?,people
info on Adnan Pathan in Digital Marketing who started from 01/01/2023?,people
Tushar Gosalia at Strategy & Planning since 01 January 2016?,people
Kumar Chandra Shekhar in Internal Communications who joined on 01/01/2021?,people
Abhimanyu Yadav in People Partners started 01/01/2024?,people
employees working from Tamil Nadu?,people
who's working from Gujarat?,people
employees in Meerut?,people
who's based in Nagpur?,people
who works out of Uttar Pradesh?,people
staff from Jamshedpur?,people
employees located in Jabalpur?,people
team members in Bhilai Nagar?,people
folks working in Maharashtra?,people
folks working from Rajasthan?,people
Associate Software Engineer working from Coimbatore?,people
"Senior Specialist, Motion Graphics expert working from Surat?",people
any Revenue Ops Manager in Guwahati?,people
Sr. Marketing Programs Manager based in Maharashtra?,people
Lead Designer out of Pune?,people
"VP, Account Management located in Odisha?",people
Credit & Collections Analyst expert located in Vijayawada?,people
Senior Customer Success Manager in Rajkot?,people
Commercial Account Manager expert in Ajmer?,people
"any SVP, Engineering working in Gaya?",people
any Consultant expert working in Maharashtra?,people
ABM Sr. Marketing Manager from Surat?,people
Workplace Specialist expert from Jammu?,people
Creative Director working in Data Science?,people
"any VP, Customer Success in Demand Generation?",people
who's the Credit & Collections Analyst in People Partners?,people
Sr. Software Engineer working in Site Reliability Engineering?,people
Software Engineer from Legal?,people
any Senior IT Engineer in Accounting?,people
Account Manager in Facilities who?,people
"VP, Commercial & SMB Sales currently in Corporate Communications?",people
TA Ops Specialist working in Digital Marketing joined on 2015-01-01?,people
Chief Technology Officer in Recognition since 2017-01-01?,people
who's the Senior Solutions Consultant in Corporate Communications from 2013-01-01?,people
Senior Field Marketing Manager working in Design as of 01 January 2024?,people
Data Scientist in Facilities joined on 01/01/2021?,people
"Executive, Talent Acquisition in Finance starting 03 July 2024?",people
any Value Consulting Director in Legal from 01/01/2014?,people
"Senior Director, Professional Services in Product since 01/01/2013?",people
who's Assistant Controller in Strategy & Planning joined 01/01/2023?,people
"Director, Data Engineering in Rev Ops starting on 01 January 2021?",people
Marketing Intern joining Internal Communications on 01 January 2016?,people
Reshab Vaigankar working as Marketing Operations and Analytics Director?,people
Hilary Somers—Commercial Account Manager?,people
Andre Gerard in the position of Marketing Copywriter?,people
Parul Sharma acting as Senior Customer Success Manager?,people
Siddharth Sharma works as AP Specialist?,people
Adam Laker working as Sr. Product Platform Manager who joined on 01/01/2021?,people
Ryn Orman working as Workplace Specialist since 01 January 2024?,people
is Shaun Spinelli the Lead Frontend Engineer who joined on 01/01/2022?,people
Sachin Verulkar—Project Manager from 01/01/2018?,people
Josh Topel's role as Chief Insights Officer starting 15 October 2015?,people
Mohammad Zaid in the position of Engineering Manager since 2023-01-01?,people
"Jay Chitnis working as Principal, Product Marketing from 2016-01-01?",people
Caroline Henderson—Sales Development Manager joined on 01/01/2023?,people
"Ivan Kos acting as Director, Product Management from 2016-01-01?",people
Ajay Hada working as Project Manager working in Accounting ?,people
Chandra Mohan Yadav working as Sr. Compensation Analyst in Technical Support?,people
is Somna Bhardwaj the AP Specialist in Internal Communications?,people
Jeff Schiller—Credit & Collections Analyst in Site Reliability Engineering?,people
Nivika Malhotra is a Program Manager in Customer Success?,people
Satyam Singh Bhadoria's role as RVP Enterprise Sales in Product Management?,people
Sathiya Priya working as Principal Product Manager in Facilities?,people
Anshuman Srinivasan—Senior Customer Success Manager at Mobile?,people
does John Tauzin work as Sr. Demand Generation Writer in Operations Strategy?,people
Jeff Ganthavorn—Credit & Collections Analyst from IT?,people
"is Theodore Surjo the VP, Corporate Marketing at Professional Services?",people
employees working in Professional Services?,people
employees in Corporate Communications?,people
who's working in Product Marketing?,people
staff in Site Reliability Engineering?,people
who works in Platform Services?,people
team members in Content Strategy?,people
who's in Sales & Field Operations?,people
people from Strategy & Planning?,people
workers in Mobile?,people
who's part of Engineering?,people
employees working in Field Marketing joined on 01/01/2013?,people
employees in Security since 01/01/2013?,people
who joined Customer Experience on 01 January 2017?,people
staff in Content Strategy from 01/01/2018?,people
who started in Field Marketing on 10/15/2015?,people
team members in Operations Strategy since 01/01/2022?,people
who's in Sales Development from 01 January 2013?,people
anyone in Operations Strategy since 01/01/2022?,people
people in Customer Experience joined on 01 January 2022?,people
workers in UX Research since 01 January 2022?,people
who's part of Sales Development from 01/01/2016?,people
all employees joined on 01/01/2016?,people
all employees since 01 January 2024?,people
who joined on 01/01/2022?,people
staff who started on 01/01/2018?,people
employees from 01/01/2022?,people
team members since 01/01/2018?,people
anyone join on 01 January 2013?,people
people who started on 01/01/2013?,people
workers from 2024-01-01?,people
who joined the team on 2022-01-01?,people
all hires from 01/01/2013?,people
FP&A Director joined on 01/01/2016?,people
"Sr. Director, Technical Support since 2022-01-01?",people
who's the Office Manager joined on 2015-10-15?,people
Mid Market Account Executive from 01 January 2014?,people
"SVP, Customer Experience started on 01/01/2022?",people
any Digital Marketing Sr. Manager since 01 January 2015?,people
"VP, Customer Success joining date 01/01/2019?",people
People Ops Specialist who joined on 01/01/2024?,people
Sr. Product Platform Manager from 01/01/2022?,people
who's the AWS Migration Lead as of 15/10/2015?,people
Sr. Marketing Coordinator hired on 01/01/2013?,people
employees joined in Vasai-Virar on 01/01/2018?,people
employees in Gujarat since 2014-01-01?,people
who joined in Rajasthan on 15 October 2015?,people
staff in Maharashtra from 2021-01-01?,people
who started in Aurangabad on 01 January 2018?,people
team members in Tamil Nadu since 01/01/2016?,people
anyone join in Gulbarga on 2024-07-03?,people
workers in Karnataka from 01 January 2022?,people
all hires in Nashik on 2015-10-15?,people
new employees in Pimpri-Chinchwad since 01 January 2020?,people
can you help me find my details ?,people
my details ?,people
find my details,people
who is Shubhada Gayakwad?,people
"who is VP, Sales Enablement?",people
who exactly is Rajat Verma?,people
can you tell me who Debasish Gayen is?,people
i'd like to know more about Tom Economou,people
could you provide details about Jordan Katz?,people
what do you know about Abhishek Singh?,people
can you enlighten me about Rajesh Saini?,people
can you identify Shashank Tripathi?,people
do you know who Harshith K.N is?,people
provide information on Gargi Pawar,people
tell me about Suzanne McReynolds,people
any details about Sushree Nayak?,people
background of Neha Singla?,people
who might Amelia Rose Kaderabek be?,people
how do you describe Nirosha Yadla?,people
can you explain who Melanie Okada is?,people
share insights on Kanish Gandhi,people
give me details about Gaurav Gupta,people
clarify who Melissa Hewitt is?,people
can you outline who Melissa Hewitt is?,people
what is the profile of Reena Khokhar?,people
i'd like details on Ansh Dhingra,people
tell me who Viviana Serrato Sotelo is?,people
could you define Neeral Singh?,people
what is known about Prince Gola?,people
give a short intro on Andrea Macek Kessler,people
introduce me to Danyelle Kent,people
give some context about Courtney Tavernit,people
please describe Kleavin Howatt,people
quick details on Ankit Prakash?,people
overview of Anmol Srivastava,people
summarize Nikhil Kumar,people
what can you share about Linda Timmons?,people
basic details on Parinay Prateek?,people
what role does Danyelle Kent have?,people
tell me the identity of Vikash Tiwari,people
can you brief me about John Kelly?,people
highlight details of Manu Bhardwaj,people
identity of Krishna Varanasi?,people
give info on Aaron Levermann,people
who goes by Somna Bhardwaj?,people
any info on Sushree Nayak?,people
description of Kevin Wu?,people
how is Shivani Juwarkar identified?,people
what is Brad Jager known for?,people
introduce Deepak Rawat,people
can you share about Noah Smithson?,people
profile of Naresh Waswani?,people
what is the role of App Integrations?,people
could you profile Randy Womack?,people
in short who is Sync Marketo?,people
tell me in brief about Anjali Chauhan,people
Siddharth Kumar Singh is who?,people
how do we know Matt Coffey?,people
what position is held by Jason Masten?,people
do you recognize Suzanne McReynolds?,people
who does Sonali Gupta refer to?,people
identity details of Krati Singhal?,people
i'd like to identify Evan Warner,people
could you clarify who Michael Berger is?,people
explain Shashiraj Sendhav,people
help me know about Kristen Best,people
background of Neha Sharma?,people
information on Justin Ryckebusch?,people
provide a description of Celia Madden,people
enlighten me about Rishab Surana,people
who currently is Commercial Account Manager?,people
"identify Sr. Director, Architecture?",people
"give me the name of Senior Manager,Technical Support",people
who carries the role of Customer Success Manager?,people
do you know the Sr. Marketing Programs Manager?,people
tell me who is Data Scientist,people
who is acting as Program Manager?,people
details about Sales Enablement Manager?,people
current holder of Senior Architect?,people
which person is Content Marketing Director?,people
name the Digital Advertising Manager,people
do you know who is Test Engineer?,people
can you confirm who is Senior Product Manager?,people
who is fulfilling the Principal Solutions Consultant role?,people
who is the present Customer Success Manager?,people
"who is appointed as VP, Solutions Consulting?",people
"which individual is the Sr. Director, Technical Support?",people
"point out the HR, Business Partner",people
who works as RVP SMB?,people
who is responsible as Sales Enablement Manager?,people
"which employee is Director, Engineering?",people
who is holding Implementation Consultant?,people
"who is engaged as Director, Implementation Consulting?",people
who is serving as Sr. Customer Success Manager?,people
i'd like to know the Chief People & Experience Officer,people
"recognized RVP, EMEA is who?",people
who plays the role of Sr. Customer Success Manager?,people
who operates as Architect?,people
"present Software Engineer, Front End is who?",people
"inform me of the Director, Dev Ops",people
who has responsibility of Sales Development Manager?,people
could you name the Product Manager?,people
which person acts as Value Consulting Director?,people
who executes the Senior Solutions Consultant role?,people
"who is the official VP, Product Management?",people
who is in charge as Snr Customer Success Mgr?,people
list the current Sales Development Rep,people
"do you have details of the VP, Engineering?",people
who is assigned as Lead Technical Architect?,people
can you highlight the Senior Solutions Consultant?,people
i'd like information about the Technical Support Engineer,people
identify current Program Manager?,people
who takes the role of Senior Software Engineer?,people
Program Manager is who?,people
"name who is Software Engineer, Front End",people
"enlighten me on the Director, Data Engineering",people
help me know the Sr. Project Manager,people
could you profile the Program Manager?,people
"who is designated VP, Engineering?",people
which one is the Sr. Test Engineer?,people
presently who is Value Consulting Director?,people
give me info on the Lead Software Engineer,people
clarify the Billing and Revenue Specialist,people
who is acknowledged as Senior Solutions Consultant?,people
who is the acting Senior Data Scientist?,people
who is filling in as Program Manager?,people
find user research resources,search
search persona library,search
look up persona library,search
find creator of simpplifier gif,search
download simpplifier gif,search
get employee newsletter updates,search
find newsletter performance improvements,search
search newsletter smart blocks,search
video playback speed options,search
survey sharing feature info,search
survey availability on platforms,search
copy survey url,search
compare ms teams and slack,search
end-user role summaries,search
enable show excerpt toggle,search
show excerpt toggle details,search
custom summary field info,search
custom summary vs show excerpt,search
