query,intent
what is the purpose of the support monday standup?,search
what topics are discussed during the support monday standup?,search
why is the support monday standup important?,search
how does the support monday standup benefit the team?,search
what is the simpplr platform?,search
what are the features of the simpplr platform?,search
what are the benefits of using the simpplr platform?,search
what use cases does the simpplr platform address?,search
is there a brochure available for the simpplr platform?,search
where can i find the brochure for the simpplr platform?,search
what are success plans?,search
how do we use success plans?,search
where can i learn more about success plans?,search
what are simpplr india's recent achievements?,search
what does the certification represent?,search
what is the significance of certifications for companies like simpplr india?,search
what are the updates on the backyard project timeline?,search
what are the customer sizes for 2024?,search
what are the customer categories for 2024?,search
can you provide an overview of the customer categories for 2024?,search
where can i find the login information for integration demo accounts?,search
what are the specific guidelines for using integration demo accounts?,search
what is the post titled 'test (please delete)' about?,search
what is the latest infosec slide deck?,search
what are the analytics enhancements in the ida release?,search
what is the purpose of the launchpad usage report?,search
how do you explain user research to customers?,search
can i nominate customers for user research?,search
what is the timeline for shifting to selling only aws?,search
what should i do if i have more questions about the transition to aws?,search
what are some useful demo environments?,search
what are the login details for the freight x demo environment?,search
does simpplr support anonymizing analytics data to comply with gdpr?,search
what about the data stored within salesforce?,search
how can i use custom fonts in simpplr?,search
where can i find a video guide on using custom fonts in simpplr?,search
what software does the sc team use for mobile app demos?,search
how do i get started with reflector?,search
what are the best practices for creating intro and outro segments for a video?,search
are there specific intro and outro segments recommended for videos about simpplr?,search
where can i find examples of intro and outro segments for videos?,search
what resources are available for creating video segments?,search
does simpplr support integration with cloud access security broker (casb) solutions?,search
which cloud access security broker (casb) solutions are supported by simpplr?,search
what are the differences in user experience with simpplr video?,search
what is the user experience like without simpplr video?,search
how does enabling native video affect user experience with simpplr?,search
what is the ragan women's retreat?,search
when is the ragan women's retreat scheduled?,search
where will the ragan women's retreat take place?,search
who can attend the ragan women's retreat?,search
what activities are included in the ragan women's retreat?,search
how can i register for the ragan women's retreat?,search
what is the cost of attending the ragan women's retreat?,search
are there any speakers or special guests at the ragan women's retreat?,search
what are the sponsorship details for the ragan future of communications conference?,search
what elements are included in simpplr's sponsorship for the hr tech conference?,search
who will be speaking at the core session of the hr tech conference?,search
how can i create curved gradient background images?,search
what are the best practices for designing gradient backgrounds?,search
where can i find video walkthroughs for simpplr?,search
are there any tutorials available for creating background images in simpplr?,search
what is the simpplr connect boston event?,search
when is the simpplr connect boston event?,search
where is the simpplr connect boston event being held?,search
where can i find the report on the 2024 state of internal communications?,search
is there a webinar associated with the 2024 state of internal communications report?,search
what are some tips on how to train ai to write in an executive's voice?,search
what are some specific strategies for training ai to write in an executive's voice?,search
can you provide examples of tips for training ai to write in an executive's voice?,search
what are the upcoming events about intranet innovations?,search
when is the event about intranet innovations scheduled to take place?,search
what is the focus of the 'liberating the inbox' campaign?,search
what are the goals of the 'liberating the inbox' campaign?,search
can you provide details about the objectives of the 'liberating the inbox' campaign?,search
what is the new update regarding device id and phone number masking in the sandbox?,search
how does the new update on device id and phone number masking benefit users?,search
what is the mobile app suggestion feature in simpplr when using a mobile browser?,search
how does the 'switch to the app' function work in simpplr?,search
what happens when a user taps 'switch to the app' in simpplr?,search
what are the latest bi-weekly status updates on the next initiative?,search
can i get more details about each workstream of the next initiative?,search
what happened at the q2 enterprise sales summit?,search
what topics were covered at the q2 enterprise sales summit?,search
what is the deadline for the sales ex messaging certification?,search
what materials do i need to review for the sales ex messaging certification?,search
how do i change my work arrangement?,search
what is the process for changing my work arrangement?,search
are there any additional resources for changing work arrangements?,search
what resources should i be aware of when changing my work arrangement?,search
what are the slas for internal bugs for aws tickets?,search
are there any slas for other severities or platforms?,search
what is the simplyic london event?,search
how do i create a book of business (bob) report in salesforce?,search
what resources are available for help with creating a book of business (bob) report in salesforce?,search
where can i find support for creating reports in salesforce?,search
what is the process for changing work arrangements?,search
what are the criteria for approval of work arrangement changes?,search
how do i set up a remote workspace?,search
what are the key points to consider when setting up a remote workspace?,search
what tools are needed for a remote workspace setup?,search
what best practices should i follow for a remote workspace?,search
how can i find the technical support playbook?,search
what topics are included in the technical support playbook?,search
where can i access the technical support playbook?,search
how can i customize my zoom waiting room?,search
what are the steps to customize the zoom waiting room?,search
what options are available for customizing the zoom waiting room?,search
what is the purpose of the backyard managers playbook?,search
who are the site managers for the backyard managers playbook?,search
what test content is available?,search
where can i find test content?,search
what are jira status translations?,search
where can i find the document on jira status translations?,search
how do i translate jira statuses?,search
is there a guide for jira status translations?,search
what are the changes to the sales process in sfdc?,search
what new fields have been added to the sales process in sfdc?,search
how can i deliver an rva without customer input?,search
what are the implications of delivering an rva without customer input?,search
what if the customer wants to see their specific data points?,search
how can i accommodate customer requests for specific data points in an rva?,search
what are the people & teams presentation slides?,search
where can i access the people & teams presentation slides?,search
what are the requirements for sow exceptions?,search
what are the requirements for sow discounts?,search
what are sow pricing exceptions?,search
what are the latest presentations for rko 2024?,search
what are the best practices for using files in backyard?,search
can you provide a summary of the best practices for using files in backyard?,search
"what were the key takeaways from the simpplr wkly sync on march 28, 2024?",search
"can i access the slides from the simpplr wkly sync meeting on march 28, 2024?",search
who authored the 'sample event' content?,search
how can i update information?,search
what are the detailed steps to update information?,search
what are effective strategies for content promotion in backyard?,search
how can i feature content in the home carousel?,search
what is a home carousel in content promotion?,search
what are the best practices for promoting content in a specific area?,search
is simpplr compliant with california's ccpa/cpra data privacy laws?,search
what are california's ccpa/cpra data privacy laws?,search
what does it mean for a company to be compliant with ccpa/cpra?,search
what are the implications of ccpa/cpra compliance for businesses?,search
how does ccpa/cpra affect consumer data privacy?,search
how can i enable automatic zoom recording transcriptions?,search
what are the benefits of enabling automatic zoom recording transcriptions?,search
what is a product playbook?,search
what is the purpose of a product playbook?,search
who can access the site?,search
what content is available on the site?,search
are there any restrictions on accessing the site?,search
what are the sharing permissions for the best of branding album on simpplr?,search
can i share screenshots from simpplr albums outside the platform?,search
what are the guidelines for sharing content from simpplr?,search
how can i connect to public wi-fi on my simpplr macos computer?,search
what should i do if i'm having trouble connecting to public wi-fi on my simpplr macos computer?,search
what are common issues when connecting to public wi-fi on macos?,search
how can i troubleshoot wi-fi connection issues on my simpplr macos computer?,search
where can i find the csm team's weekly running notes?,search
what is the women's retreat for top communicators?,search
what are the objectives of the women's retreat for top communicators?,search
where is the women's retreat for top communicators being held?,search
what is the schedule for the women's retreat for top communicators?,search
who will be attending the women's retreat for top communicators from simpplr?,search
what is the significance of simpplr's attendance at the women's retreat for top communicators?,search
who are the other attendees at the women's retreat for top communicators?,search
how do i create a new project in teamwork?,search
what can i expect from the april 2024 marketing mbr?,search
what is the purpose of the april 2024 marketing mbr?,search
is the april 2024 marketing mbr a mandatory meeting?,search
who is required to attend the april 2024 marketing mbr?,search
how can i access my payslip?,search
what do i need to log in to access my payslip?,search
what are the new features in the 24.03 release?,search
is there a q&a session available?,search
what resources are available for customer onboarding?,search
how can i leverage customer onboarding resources?,search
what are the new apis available in the extensibility center?,search
where can i find the new apis in the extensibility center?,search
what are desk-bound end-user personas?,search
how are desk-bound end-user personas different from frontline workers?,search
what is the ur training/refresher scheduled for february 2024?,search
where can i find information about the ur training/refresher in february 2024?,search
what are the new fields added in salesforce for workplace replacement?,search
can you explain the quality consciousness: explicit sign-offs process?,search
what are end-user personality personas?,search
can you provide more details on end-user personality personas?,search
what are the latest updates on images and social campaigns?,search
is there a video explanation available?,search
what is the ragan employee experience conference?,search
when is the ragan employee experience conference taking place?,search
where will the ragan employee experience conference be held?,search
who will be speaking at the ragan employee experience conference?,search
what topics will be covered at the ragan employee experience conference?,search
how can i register for the ragan employee experience conference?,search
what is the norwest + simpplr cio networking event?,search
when is the norwest + simpplr cio networking event taking place?,search
where will the norwest + simpplr cio networking event be held?,search
who is hosting the norwest + simpplr cio networking event?,search
what topics will be discussed at the norwest + simpplr cio networking event?,search
how can i register for the norwest + simpplr cio networking event?,search
how can i capture video transcript text in simpplr?,search
is there a workaround for capturing the full text in simpplr?,search
how do servicenow notifications work in simpplr?,search
what do i need to do to receive notifications in simpplr?,search
what does the error 'attempt to de-reference a null object' mean in simpplr?,search
how can i fix the error 'attempt to de-reference a null object' in simpplr?,search
what are common solutions for fixing errors in simpplr?,search
what is the iabc world conference?,search
when and where is the iabc world conference taking place?,search
who are the speakers at the iabc world conference?,search
what topics will be covered in the sessions at the iabc world conference?,search
what is the schedule for the sessions at the iabc world conference?,search
what is the anonymized value assessment for a shipping company?,search
what are the criteria used in the anonymized value assessment for a shipping company?,search
what are the results of the anonymized value assessment for a shipping company?,search
how can i obtain a copy of the anonymized value assessment for a shipping company?,search
what are the alternatives to workplace by meta?,search
what features does simpplr offer?,search
what are the department user persona summaries?,search
who created the department user persona summaries?,search
what is an anonymized value assessment for a software company?,search
what specific information is included in an anonymized value assessment for a software company?,search
Aarav,people
Vivaan,people
Aditya,people
Vihaan,people
Arjun,people
Sai,people
Reyansh,people
Krishna,people
Ishaan,people
Rohan,people
Kartik,people
Atharv,people
Shivansh,people
Dhruv,people
Entrepreneur,people
CEO,people
CTO,people
CFO,people
COO,people
Director,people
Vice President,people
President,people
Chairman,people
Clerk,people
Cashier,people
Customer Support,people
Python Specialist,people
Java Specialist,people
C++ Specialist,people
JavaScript Specialist,people
SQL Specialist,people
React Specialist,people
Node.js Specialist,people
HTML/CSS Specialist,people
Machine Learning Specialist,people
Deep Learning Specialist,people
Artificial Intelligence Specialist,people
Data Science Specialist,people
Big Data Specialist,people
best restaurants near me,search
weather today in Delhi,search
how to cook biryani,search
nearest petrol pump,search
train timings from Delhi to Agra,search
latest iPhone price,search
how to lose weight fast,search
cheap hotels in Goa,search
what is artificial intelligence,search
top 10 Bollywood movies,search
buy laptop online,search
distance between Mumbai and Pune,search
how to learn python,search
flights from Bangalore to Dubai,search
nearest ATM,search
pizza delivery near me,search
IPL score live,search
best MBA colleges in India,search
how to make resume,search
current gold price in India,search
restaurants open now,search
nearest hospital,search
1.2,search
3.4,search
5.6,search
7.8,search
9.1,search
10.5,search
12.3,search
14.7,search
16.8,search
18.9,search
20.2,search
22.4,search
24.6,search
26.8,search
28.9,search
30.1,search
32.3,search
34.5,search
36.7,search
38.9,search
40.2,search
42.4,search
44.6,search
46.8,search
48.9,search
50.1,search
52.3,search
54.5,search
56.7,search
58.9,search
60.2,search
62.4,search
64.6,search
66.8,search
holiday,search
benefit,search
Pratik email,people
Aarav email,people
Neha email,people
Rohit email,people
Ananya email,people
Siddharth email,people
Priya email,people
Karan email,people
Isha email,people
Amit email,people
Shreya email,people
Rahul email,people
Sneha email,people
Arjun email,people
Tanvi email,people
Vikram email,people
Madhuri email,people
Kabir email,people
Avni email,people
Ritika email,people
Harsh email,people
Pooja email,people
Manav email,people
Diya email,people
Ankit email,people
Node.js Specialist,people
HTML/CSS Specialist,people
Machine Learning Specialist,people
Deep Learning Specialist,people
Artificial Intelligence Specialist,people
Data Science Specialist,people
Big Data Specialist,people
Cloud Computing Specialist,people
AWS Specialist,people
Microsoft Azure Specialist,people
Google Cloud Specialist,people